;2015;2014;2013;2012;2011;2010never Changing Person ID;persnr;persnr;persnr;persnr;persnr;persnrYear of Birth;bfpbirthy;bep12603;bdp13403;bcp12803;bbp13202;bap15002Sex;bfpsex;bep12601;bdp13401;bcp12801;bbp13201;bap15001Black Economy Work in Personal Environment 2014;bfp08;;;;;Black Economy Work Personal Environment Today;bfp09;;;;;Hours Weekdays Job, Training;bfp1001;bep0501;bdp1001;bcp0401;bbp0201;bap0301Hours Weekdays Running Errands;bfp1002;bep0502;bdp1002;bcp0402;bbp0202;bap0302Hours Weekday Housework;bfp1003;bep0503;bdp1003;bcp0403;bbp0203;bap0303Hours Weekday Child Care;bfp1004;bep0504;bdp1004;bcp0404;bbp0204;bap0304Support Persons in Care, Weekday;bfp1005;bep0505;bdp1005;bcp0405;bbp0205;bap0305Hours Weekdays Training, Education;bfp1006;bep0506;bdp1006;bcp0406;bbp0206;bap0306Hours Weekday Repairs;bfp1007;bep0507;bdp1007;bcp0407;bbp0207;bap0307Hours Weekdays Physical Activities;bfp1008;bep0508;bdp1008;bcp0408;bbp0208;bap0308Hours Weekday Leisure, Hobbies;bfp1009;bep0509;bdp1009;bcp0409;bbp0209;bap0309Registered Unemployed;bfp15;bep09;bdp15;bcp08;bbp06;bap06Now Receiving Education, Training;bfp1601;bep1001;bdp16;bcp09;bbp07;bap07Now General-Education School;bfp1701;bep1101;bdp1701;bcp1001;bbp0801;bap0801Now Specialized College;bfp1702;bep1102;bdp1702;bcp1002;bbp0802;bap0802Vocational Training: Further Training/Retraining;bfp1707;bep1106;bdp1706;bcp1106;bbp0804;bap0804Now Vocational Training;bfp1709;bep1107;bdp1707;bcp1007;bbp0805;bap0805Left Job Since Beginning of Prev Year;bfp26;bep78;bdp91;bcp73;bbp85;bap75Last Job Ended - Item Nonresponse;bfp2703;bep7903;bdp9203;bcp7403;bbp8603;bap76Years Worked on Last Job;bfp2801;bep8001;bdp9301;bcp7501;bbp8701;bap7701Why Job Terminated;bfp29;bep81;bdp94;bcp76;bbp88;bap78Future Job Prospects;bfp31;bep83;bdp96;bcp78;bbp90;bap80Employment Status;bfp32;bep12;bdp18;bcp11;bbp09;bap09Monthly Salary at which would take Job;bfp3701;bep1701;bdp2301;bcp1601;bbp1401;bap1401Temporary or Contractual Basis;bfp60;bep37;bdp48;bcp37;bbp39;bap35Duration of Work ;bfp61;bep38;bdp49;bcp38;bbp40;bap361-Euro-Job;bfp62;;;;;Just Gross Income;bfp67;;;;;Just Net Income;bfp69;;;;;Difficulty of Finding New Job;bfp71;bep40;bdp55;bcp41;bbp46;bap40Working Days per Week;bfp8001;;bdp6301;bcp4701;bbp5401;Contracted Working Hours;bfp8101;bep4701;bdp6501;bcp5001;bbp6301;bap5001Flexible Hours of Work per Week;bfp8102;bep4702;bdp6502;bcp5002;bbp6302;bap5002Hours per Week Actual;bfp82;bep48;bdp66;bcp51;bbp64;bap51Mini- Job, Midi- Job;bfp83;bep49;bdp67;bcp52;bbp65;bap52Changes in Labor Intensity;bfp91;;;;;Do not Take Paid Breaks;bfp9602;;;;;Work Overtime;bfp97;bep52;bdp72;bcp55;bbp69;bap57Financial Compensation for Overtime;bfp10101;;;;;Tariff Standard in Earnings;bfp103;;;;;Collective Wage Agreement Minimum Wage;bfp10401;;;;;Minimum Wage EUR;bfp10402;;;;;Minimum Wage Cent;bfp10403;;;;;Fixed Minimum Wage Prev. Yr;bfp10501;;;;;Minimum Wage Pr Yr Eur;bfp10502;;;;;Minimum Wage Pr Yr Cents;bfp10503;;;;;Bonus for Work Under Difficult Conditions;bfp10603;bep5803;;bcp6003;;bap6203Additional Regular Payment;bfp10604;bep5804;;bcp604;;bap6204Tips;bfp10605;bep5805;;bcp6005;;bap6205Benefits from Employers: Meal Stipend;bfp10701;bep5901;;bcp6101;;bap6301Benefits from Employers: Company car;bfp10702;bep5902;;bcp6102;;bap6302Benefits from Employers: Cell Phone;bfp10703;bep5903;;bcp6103;;bap6303Benefits from Employers: Expense Payments;bfp10704;bep5904;;bcp6104;;bap6304Benefits from Employers: Personal Computer;bfp10705;bep5905;;bcp6105;;bap6305Benefits from Employers: Other Benefits;bfp10706;bep5906;;bcp6106;;bap6306Benefits from Employers: None;bfp10707;bep5907;;bcp6107;;bap6307Regular Second Job;bfp10902;bep6002;bdp8002;bcp6202;bbp7402;bap6402Second Job, Days Per Month;bfp111;bep62;bdp83;bcp64;bbp76;bap66Hours Per Week on Second Job;bfp112;;;;;Second Job, Gross Income last Month;bfp113;bep64;bdp85;bcp67;bbp79;bap69Unemployment Benefit Jan-Dec Prev Yr;bfp114h01;bep85h01;bdp98h01;bcp80h01;bbp92h01;bap82h01Unemployment Benefit;bfp114h01m;bep6505;bdp8605;bcp6805;bbp8005;bap7005Current Health;bfp127;bep89;bdp110;bcp91;bbp97;bap87Both Parents German Native Language;bfp153;;bdp138;;bbp135;Speaking German;bfp15401;;bdp13901;;bbp13601;bap13201Writing German;bfp15402;;bdp13902;;bbp13602;bap13202Label;bfp15403;;bdp13903;;bbp13603;bap13203Contracted Weekly Working Time;bfp_zaz08;bep_zaz08;;;;Actual Weekly Working Hours;bfp_zaz10;bep_zaz10;;;;Salary/Earnings 2014 Non_Response;bfp_zvek01;bep_zvek01;;;;EU Citizen;bfpm_p_48;;;;;Permanent Residency;bfpm_p_49;;;;;Nationality;nation15;nation14;nation13;nation12;nation11;nation10Current Gross Labor Income in Euro;labgro15;labgro14;labgro13;labgro12;labgro11;labgro10Current Net Labor Income in Euro;labnet15;labnet14;labnet13;labnet12;labnet11;labnet10Current Gross Secondary Income in Euro;sndjob15;sndjob14;sndjob13;sndjob12;sndjob11;sndjob10Employment Status;emplst15;emplst14;emplst13;emplst12;emplst11;emplst10Labor Force Status;lfs15;lfs14;lfs13;lfs12;lfs11;lfs10Last Reached Isei Value(International Socio-Economic Index);isei88_15;isei88_14;isei88_13;isei88_12;isei88_11;isei88_10Required Training for Job;ausb15;ausb14;ausb13;ausb12;ausb11;ausb10Actual Work Time Per Week;bftatzeit;betatzeit;bdtatzeit;bctatzeit;bbtatzeit;batatzeitAgreed Upon Work Time Per Week;bfvebzeit;bevebzeit;bdvebzeit;bcvebzeit;bbvebzeit;bavebzeitOvertime Per Week;bfuebstd;beuebstd;bduebstd;bcuebstd;bbuebstd;bauebstdSize of the company;betr15;betr14;betr13;betr12;betr11;betr10Working Experience Full-Time Employment;expft15;expft14;expft13;expft12;expft11;expft10Unemployment Experience;expue15;expue14;expue13;expue12;expue11;expue10Amount of Education Or Training in Years;bfbilzeit;bebilzeit;bdbilzeit;bcbilzeit;bbbilzeit;babilzeitSchool-Leaving Degree;bfpsbil;bepsbil;bdpsbil;bcpsbil;bbpsbil;bapsbilVocational Degree Received;bfpbbil01;bepbbil01;bdpbbil01;bcpbbil01;bbpbbil01;bapbbil01College Degree;bfpbbil02;bepbbil02;bdpbbil02;bcpbbil02;bbpbbil02;bapbbil02No Vocational Degree;bfpbbil03;bepbbil03;bdpbbil03;bcpbbil03;bbpbbil03;bapbbil03School-Leaving Degree East Germany;bfpsbilo;bepsbilo;bdpsbilo;bcpsbilo;bbpsbilo;bapsbiloVocational Degree Received East Germany;bfpbbilo;bepbbilo;bdpbbilo;bcpbbilo;bbpbbilo;bapbbiloSchool-Leaving Degree Outside Germany;bfpsbila;bepsbila;bdpsbila;bcpsbila;bbpsbila;bapsbilaVocational Degree Outside Germany;bfpbbila;bepbbila;bdpbbila;bcpbbila;bbpbbila;bapbbilaEmployed Full-Time in Prev. Yr;bfp1a01;bep1a01;bdp1a01;bcp1a01;bbp1a01;bap1a01Employed Full-Time No. Month Prev. Yr;bfp1a02;bep1a02;bdp1a02;bcp1a02;bbp1a02;bap1a02Employed Part-Time in Prev. Yr;bfp1b01;bep1b01;bdp1b01;bcp1b01;bbp1b01;bap1b01Employed Part-Time No. Months Prev. Yr;bfp1b02;bep1b02;bdp1b02;bcp1b02;bbp1b02;bap1b02Officially Unemployed Prev Yr;bfp1d01;bep1d01;bdp1d01;bcp1d01;bbp1d01;bap1d01Officially Unemployed Prev Yr No. Month;bfp1d02;bep1d02;bdp1d02;bcp1d02;bbp1d02;bap1d02Maternity Benefit in Prev. Yr;bfp1f01;bep1f01;bdp1f01;bcp1f01;bbp1f01;bap1f01Maternity Benefit No. Months Prev. Yr;bfp1f02;bep1f02;bdp1f02;bcp1f02;bbp1f02;bap1f02In School, College in Prev. Yr;bfp1g01;bep1g01;bdp1g01;bcp1g01;bbp1g01;bap1g01In School, College No. Month Prev. Yr;bfp1g02;bep1g02;bdp1g02;bcp1g02;bbp1g02;bap1g02On-the-Job Training,Retraining Prev. Yr;bfp1m01;bep1m01;bdp1m01;bcp1m01;bbp1m01;bap1m01On-the-Job Training,Retraining No. Month Prev. Yr;bfp1m02;bep1m02;bdp1m02;bcp1m02;bbp1m02;bap1m02Mini-Job (up too 400€) Prev. Yr;bfp1n01;bep1n01;bdp1n01;bcp1n01;bbp1n01;bap1n01Mini-Job (up too 400€) No. Month Prev. Yr;bfp1n02;bep1n02;bdp1n02;bcp1n02;bbp1n02;bap1n02Own Earnings;bfj04;bej04;bdj04;bcj04;bbj04;baj04Full-Time, Part-Time, Trainee;bfj05;bej05;bdj05;bcj05;bbj05;baj05Have Already Worked Before;bfj06;bej06;bdj06;bcj06;bbj06;baj06Age At First Job;bfj07;bej07;bdj07;bcj07;bbj07;baj07Reason For Working;bfj08;bej08;bdj08;bcj08;bbj08;baj08